{
  "$schema": "https://json-schema.org/draft/2020-12/schema",
  "$id": "https://intelligent-project.eu/ontology/v1.0.0/assets/AssetControlCommand",
  "title": "int:AssetControlCommand",
  "description": "Control command issued to a controllable asset by the FOS Trading Module. Subclass of sosa:Actuation.",
  "type": "object",
  "properties": {
    "assetId": {
      "description": "FK to target Asset. IRI: int:assetId. UUID v4.",
      "type": "string",
      "format": "uuid"
    },
    "controlMode": {
      "description": "Control mode for the asset. IRI: int:controlMode.",
      "type": "string",
      "maxLength": 25
    },
    "powerSetpointkw": {
      "description": "Power setpoint in kilowatts. IRI: int:powerSetpointkw. Unit: kW.",
      "type": [
        "number",
        "null"
      ],
      "default": null
    },
    "fracSetpoint": {
      "description": "Fractional setpoint (0.0-1.0). IRI: int:fracSetpoint.",
      "type": [
        "number",
        "null"
      ],
      "minimum": 0,
      "maximum": 1,
      "default": null
    },
    "on": {
      "description": "On/off command. IRI: int:on.",
      "type": [
        "boolean",
        "null"
      ],
      "default": null
    },
    "tempHeatSetpointC": {
      "description": "Heating temperature setpoint in degrees Celsius. IRI: int:tempHeatSetpointC. Unit: \u00b0C.",
      "type": [
        "number",
        "null"
      ],
      "default": null
    },
    "tempCoolSetpointC": {
      "description": "Cooling temperature setpoint in degrees Celsius. IRI: int:tempCoolSetpointC. Unit: \u00b0C.",
      "type": [
        "number",
        "null"
      ],
      "default": null
    },
    "tempwaterheaterSetpointC": {
      "description": "Water heater temperature setpoint in degrees Celsius. IRI: int:tempwaterheaterSetpointC. Unit: \u00b0C.",
      "type": [
        "number",
        "null"
      ],
      "default": null
    },
    "timestamp": {
      "description": "Command issue timestamp. IRI: int:timestamp. ISO 8601 with timezone.",
      "type": "string",
      "format": "date-time"
    }
  },
  "required": [
    "assetId",
    "controlMode",
    "timestamp"
  ],
  "additionalProperties": false
}