[
  {
    "assetId": "11111111-1111-4111-8111-111111111111",
    "controlMode": "setpoint",
    "powerSetpointkw": 3.5,
    "timestamp": "2026-08-03T09:00:00+02:00"
  },
  {
    "assetId": "22222222-2222-4222-8222-222222222222",
    "controlMode": "onoff",
    "on": false,
    "timestamp": "2026-08-03T09:05:00+02:00"
  },
  {
    "assetId": "33333333-3333-4333-8333-333333333333",
    "controlMode": "thermostat",
    "tempHeatSetpointC": 21.5,
    "tempCoolSetpointC": 24.0,
    "timestamp": "2026-08-03T09:10:00+02:00"
  }
]
